id,title,environments,aliases,owners,primary_url,department,notes,pope_tech,errors,active,cms
619,Affordance Perception-Action Laboratory,"test, prod","apal.stg.umn.edu, apal.dev.umn.edu, apal.dl8.umn.edu","kin, sweet006",apal.umn.edu,CLA - College of Liberal Arts,Moved from CLA - PSYCH - Psychology on 2025-05-15,True,,True,Drupal
583,ANGST Lab,"test, prod","angst.dl8.umn.edu, angst.stg.umn.edu, angst.psych.umn.edu",smoeller,angst.umn.edu,CLA - College of Liberal Arts,None,True,,True,Drupal
626,Auditory Perception and Cognition Laboratory,"test, prod","apc.dl8.umn.edu, apc.stg.umn.edu, apc.psych.umn.edu",smoeller,sandbox-apc.psych.umn.edu,CLA - College of Liberal Arts,Moved from CLA - PSYCH - Psychology on 2025-05-15,True,,True,Drupal
634,Brain and Behavioral Processes Laboratory,"test, prod","lucianalab.dl8.umn.edu, lucianalab.dev.umn.edu, lucianalab.stg.umn.edu",lucia003,lucianalab.psych.umn.edu,CLA - College of Liberal Arts,Moved from CLA - PSYCH - Psychology on 2025-05-15,True,,True,Drupal
642,Center for Applied & Translational Sensory Science,"test, prod","catss.dl8.umn.edu, catss.stg.umn.edu",smoeller,catss.umn.edu,CLA - College of Liberal Arts,Moved from CLA - PSYCH - Psychology on 2025-05-15,True,,True,Drupal
640,Center for Clinical Movement Science,"test, prod","ccms.dl8.umn.edu, ccms.stg.umn.edu, ccms.dev.umn.edu, www.ccms.umn.edu",smoeller,ccms.umn.edu,CLA - College of Liberal Arts,Moved from CLA - PSYCH - Psychology on 2025-05-15,True,,True,Drupal
606,CLA Intranet,"dev, test, prod","intranet-cla.dev.umn.edu, intranet-cla.stg.umn.edu, neighborhood.cla.umn.edu, www.neighborhood.cla.umn.edu, claneighborhood.umn.edu, www.claneighborhood.umn.edu",simonw,intranet.cla.umn.edu,CLA - College of Liberal Arts,None,True,,True,Drupal
527,College of Liberal Arts,"dev, test, prod","cla.dev.umn.edu, cla.stg.umn.edu, www.cla.umn.edu, cla.umn.edu","simonw, thom7978",cla.umn.edu,CLA - College of Liberal Arts,None,True,,True,Drupal
643,Decision Making Laboratory,prod,dmlab.psych.umn.edu,smoeller,dmlab.psych.umn.edu,CLA - College of Liberal Arts,Moved from CLA - PSYCH - Psychology on 2025-05-15,True,,True,Drupal
631,DeYoung Lab,"test, prod","deyoung.dl8.umn.edu, deyoung.stg.umn.edu, deyoung.psych.umn.edu",cdeyoung,deyoung.umn.edu,CLA - College of Liberal Arts,Moved from CLA - PSYCH - Psychology on 2025-05-15,True,,True,Drupal
627,Engel Vision & Imaging Laboratory,"test, prod","engellab.dl8.umn.edu, engellab.stg.umn.edu, engellab.dev.umn.edu, engellab.psych.umn.edu",smoeller,engellab.umn.edu,CLA - College of Liberal Arts,Moved from CLA - PSYCH - Psychology on 2025-05-15,True,,True,Drupal
624,Exercise & Mental Health Research,"dev, test, prod","emh.stg.umn.edu, emh.dev.umn.edu, emh.dl8.umn.edu, emhl.umn.edu, healthymom.umn.edu","sweet006, kin",emh.umn.edu,CLA - College of Liberal Arts,Moved from CLA - PSYCH - Psychology on 2025-05-15,True,,True,Drupal
636,Gordon Legge,"test, prod","legge.dl8.umn.edu, legge-psych.dev.umn.edu, legge.stg.umn.edu, legge.dev.umn.edu, gellab.psych.umn.edu","gagex037, smoeller",legge.psych.umn.edu,CLA - College of Liberal Arts,Moved from CLA - PSYCH - Psychology on 2025-05-15,True,,True,Drupal
570,Health and Eating Laboratory,prod,"mannlab-psych.dev.umn.edu, mannlab-psych.stg.umn.edu, mannlab-psych.dl9.umn.edu",smoeller,mannlab.psych.umn.edu,CLA - College of Liberal Arts,None,True,,True,Drupal
620,Human and Sport Performance Laboratory,"test, prod","hspl.stg.umn.edu, hspl.dev.umn.edu, hspl.dl8.umn.edu","kin, sweet006",hspl.umn.edu,CLA - College of Liberal Arts,Moved from CLA - PSYCH - Psychology on 2025-05-15,True,,True,Drupal
571,"Human Attention, Memory, and Cognition",prod,"hamc-psych.dev.umn.edu, hamc-psych.stg.umn.edu, amclab.psych.umn.edu",smoeller,hamc.psych.umn.edu,CLA - College of Liberal Arts,None,True,,True,Drupal
617,Human Performance Teaching Laboratory,"test, prod","hptl.dl8.umn.edu, hptl.stg.umn.edu, hptl.dev.umn.edu","kin, sweet006",hptl.umn.edu,CLA - College of Liberal Arts,Moved from CLA - PSYCH - Psychology on 2025-05-15,True,,True,Drupal
522,Identity and Well-being Research Lab,prod,"iwell-psych.dev.umn.edu, iwell-psych.stg.umn.edu",smoeller,iwell.psych.umn.edu,CLA - College of Liberal Arts,None,True,,True,Drupal
621,Laboratory of Integrative Human Physiology,"test, prod","lihp.stg.umn.edu, lihp.dev.umn.edu, lihp.dl8.umn.edu","kin, sweet006",lihp.umn.edu,CLA - College of Liberal Arts,Moved from CLA - PSYCH - Psychology on 2025-05-15,True,,True,Drupal
574,Language Testing Program,prod,"languagetesting.dev.umn.edu, languagetesting.stg.umn.edu",sisom008,languagetesting.umn.edu,CLA - College of Liberal Arts,None,True,,True,Drupal
553,lctip.umn.edu,"dev, test, prod","lctip.dev.umn.edu, lctip.stg.umn.edu",sisom008,lctip.umn.edu,CLA - College of Liberal Arts,None,True,,True,Drupal
629,Meehl Faculty Page,"test, prod","meehl.stg.umn.edu, meehl.dev.umn.edu, meehl.dl8.umn.edu",smoeller,meehl.umn.edu,CLA - College of Liberal Arts,Moved from CLA - PSYCH - Psychology on 2025-05-15,True,,True,Drupal
582,Minnesota Center for Twin and Family Research,prod,"mctfr.psych.dev.umn.edu, mctfr-psych.dl8.umn.edu, www.mctfr.psych.umn.edu",smoeller,mctfr.psych.umn.edu,CLA - College of Liberal Arts,None,True,,True,Drupal
563,Minnesota Multiphasic Personality Inventory (MMPI),prod,"mmpi.dl9.umn.edu, mmpi.dl9.dev.umn.edu, mmpi.dl9.stg.umn.edu",smoeller,mmpi.umn.edu,CLA - College of Liberal Arts,None,True,,True,Drupal
639,NICE Lab,"test, prod","nice-lab.dl8.umn.edu, nice-lab.dev.umn.edu, nice-lab.stg.umn.edu, nice-lab.umn.edu",moin,nice-lab.umn.edu,CLA - College of Liberal Arts,Moved from CLA - PSYCH - Psychology on 2025-05-15,True,,True,Drupal
613,Olman Laboratory for Imaging and Vision,"test, prod","oliv.stg.umn.edu, oliv.dev.umn.edu, oliv.dl9.umn.edu",caolman,oliv.psych.umn.edu,CLA - College of Liberal Arts,Moved from CLA - PSYCH - Psychology on 2025-05-15,True,,True,Drupal
524,Psychology 5993 Pathways,prod,"pathways5993-psych.dev.umn.edu, pathways5993-psych.stg.umn.edu",smoeller,pathways5993.psych.umn.edu,CLA - College of Liberal Arts,None,True,,True,Drupal
641,Psychology Intranet,"dev, test, prod","psych.dl9.umn.edu, psych.stg.umn.edu, psych.dev.umn.edu, intranet.psych.umn.edu","smoeller, amsuchy",intranet.psych.umn.edu,CLA - College of Liberal Arts,Moved from CLA - PSYCH - Psychology on 2025-05-15,True,,True,Drupal
612,RAD Lab,"test, prod","radlab.stg.umn.edu, radlab.dev.umn.edu, radlab.dl9.umn.edu","kamp0182, smoeller",radlab.umn.edu,CLA - College of Liberal Arts,Moved from CLA - PSYCH - Psychology on 2025-05-15,True,,True,Drupal
622,School of Kinesiology - Graduate Student Resources,"test, prod","kingrad.stg.umn.edu, kingrad.dev.umn.edu, kingrad.dl8.umn.edu","sweet006, kin",kingrad.umn.edu,CLA - College of Liberal Arts,Moved from CLA - PSYCH - Psychology on 2025-05-15,True,,True,Drupal
623,Skeletal Muscle Plasticity and Regeneration Laboratory,"test, prod","smprl.stg.umn.edu, smprl.dev.umn.edu, smprl.dl8.umn.edu","sweet006, kin",smprl.umn.edu,CLA - College of Liberal Arts,Moved from CLA - PSYCH - Psychology on 2025-05-15,True,,True,Drupal
632,Social Interaction Lab,"test, prod","socialinteractionlab.dl8.umn.edu, socialinteractionlab.dev.umn.edu, socialinteractionlab.stg.umn.edu",smoeller,socialinteractionlab.psych.umn.edu,CLA - College of Liberal Arts,Moved from CLA - PSYCH - Psychology on 2025-05-15,True,,True,Drupal
525,Social Team Research in Promoting Health Equity,prod,"stripelab-psych.dev.umn.edu, stripelab-psych.stg.umn.edu",smoeller,stripelab.psych.umn.edu,CLA - College of Liberal Arts,None,True,,True,Drupal
618,Sports Medicine Psychology Laboratory,"test, prod","smpl.stg.umn.edu, smpl.dev.umn.edu, smpl.dl8.umn.edu","kin, sweet006",smpl.umn.edu,CLA - College of Liberal Arts,Moved from CLA - PSYCH - Psychology on 2025-05-15,True,,True,Drupal
638,The Center for the Study of the Individual and Society,"test, prod","csis.dl8.umn.edu, csis.dev.umn.edu, csis.stg.umn.edu","smoeller, msnyder",csis.psych.umn.edu,CLA - College of Liberal Arts,Moved from CLA - PSYCH - Psychology on 2025-05-15,True,,True,Drupal
630,TriCam,"test, prod","tricam.stg.umn.edu, tricam.dev.umn.edu, tricam.dl8.umn.edu",smoeller,tricam.psych.umn.edu,CLA - College of Liberal Arts,Moved from CLA - PSYCH - Psychology on 2025-05-15,True,,True,Drupal
633,Vocational Psychology Research,"test, prod","vpr.dl8.umn.edu, vpr.stg.umn.edu, vpr.psych.umn.edu",smoeller,vpr.umn.edu,CLA - College of Liberal Arts,Moved from CLA - PSYCH - Psychology on 2025-05-15,True,,True,Drupal
590,Writing in Psychology,"dev, prod","writing.psych.dl8.umn.edu, writing-psych.dev.umn.edu, writing.psych.umn.edu",smoeller,writing.psych.umn.edu,CLA - College of Liberal Arts,None,True,,True,Drupal
